{
  "required" : true ,
  "$schema" : "http://json-schema.org/draft-03/schema" ,
  "type" : "object" ,
  "properties" : {
    "paymentMethodId" : {
      "type" : "string" ,
      "required" : false
    } ,
    "paymentId" : {
      "type" : "string" ,
      "required" : false
    } ,
    "paidAmount" : {
      "type" : "number" ,
      "required" : false
    } ,
    "subscriptionNumber" : {
      "type" : "string" ,
      "required" : false
    } ,
    "subscriptionId" : {
      "type" : "string" ,
      "required" : false
    } ,
    "accountId" : {
      "type" : "string" ,
      "required" : false
    } ,
    "success" : {
      "type" : "boolean" ,
      "required" : false
    } ,
    "accountNumber" : {
      "type" : "string" ,
      "required" : false
    } ,
    "invoiceId" : {
      "type" : "string" ,
      "required" : false
    }
  }
}