{
  "paymentMethodId" : "2c92c8f83dcbd8b1013dcce096b0000b" ,
  "paymentId" : "2c92c8f83dcbd8b1013dcce09f420032" ,
  "paidAmount" : 599.55 ,
  "subscriptionNumber" : "A-S00001083" ,
  "subscriptionId" : "2c92c8f83dcbd8b1013dcce0983b0015" ,
  "accountId" : "2c92c8f83dcbd8b1013dcce096790008" ,
  "success" : true ,
  "accountNumber" : "A00030968" ,
  "invoiceId" : "2c92c8f83dcbd8b1013dcce09d110025"
}